{
  "map_name": "dys_codex_5_3_thinking",
  "grid": 128,
  "districts": [
    {
      "name": "corp_spire",
      "type": "corporate",
      "bounds": [-2432, -1408, -768, 1408],
      "material_theme": "sterile_corporate",
      "preferred_material_groups": ["urban", "twincannon", "broadcast"]
    },
    {
      "name": "mid_exchange",
      "type": "datacore",
      "bounds": [-768, -896, 768, 896],
      "material_theme": "neon_datacore",
      "preferred_material_groups": ["broadcast", "adverts", "twincannon"]
    },
    {
      "name": "punk_refinery",
      "type": "industrial",
      "bounds": [768, -1408, 2432, 1408],
      "material_theme": "rust_industrial",
      "preferred_material_groups": ["vaccine", "vaccinecore", "urban"]
    }
  ],
  "streets": [
    {
      "name": "iron_spine",
      "path": [[-2048, 0], [-1024, 0], [0, 0], [1024, 0], [2048, 0]],
      "width": 384
    },
    {
      "name": "north_loop",
      "path": [[-1664, 832], [-768, 1024], [0, 1152], [768, 1024], [1664, 832]],
      "width": 256
    },
    {
      "name": "south_loop",
      "path": [[-1664, -832], [-768, -1024], [0, -1152], [768, -1024], [1664, -832]],
      "width": 256
    },
    {
      "name": "crossfeed",
      "path": [[0, -1152], [0, 0], [0, 1152]],
      "width": 192
    }
  ],
  "buildings": [
    {
      "id": "corp_spawn_hab",
      "style": "block",
      "base": [-2176, -448],
      "size": [512, 896],
      "height": 256,
      "floors": 2,
      "roof_access": true,
      "materials": {
        "floor": "urban/conc_clean2",
        "wall": "twincannon/dys_office/office_wall2",
        "roof": "vaccine/dys_metalroof"
      }
    },
    {
      "id": "corp_north_tower",
      "style": "tower",
      "base": [-1792, 768],
      "size": [512, 512],
      "height": 512,
      "floors": 4,
      "roof_access": true,
      "materials": {
        "floor": "urban/conc_clean2",
        "wall": "vaccinecore/metal_panelwall_001",
        "roof": "twincannon/cube_white"
      }
    },
    {
      "id": "corp_south_tower",
      "style": "tower",
      "base": [-1792, -1280],
      "size": [512, 512],
      "height": 448,
      "floors": 4,
      "roof_access": true,
      "materials": {
        "floor": "urban/conc_clean2",
        "wall": "dys_fortress/dys_fortress-vaccine-detail3base",
        "roof": "twincannon/cube_white"
      }
    },
    {
      "id": "center_datacore_plinth",
      "style": "plaza",
      "base": [-320, -320],
      "size": [640, 640],
      "height": 128,
      "floors": 1,
      "roof_access": true,
      "materials": {
        "floor": "twincannon/concretefloor009a_fixed",
        "wall": "dys_fortress/dys_fortress-vaccine-detail6base",
        "roof": "twincannon/cube_white"
      }
    },
    {
      "id": "center_north_screen",
      "style": "screen",
      "base": [-192, 448],
      "size": [384, 128],
      "height": 320,
      "floors": 1,
      "roof_access": false,
      "materials": {
        "floor": "urban/conc_clean2",
        "wall": "broadcast/screens/firewall",
        "roof": "twincannon/cube_white"
      }
    },
    {
      "id": "center_south_screen",
      "style": "screen",
      "base": [-192, -576],
      "size": [384, 128],
      "height": 320,
      "floors": 1,
      "roof_access": false,
      "materials": {
        "floor": "urban/conc_clean2",
        "wall": "broadcast/screens/txscroll",
        "roof": "twincannon/cube_white"
      }
    },
    {
      "id": "ring_bridge_north",
      "style": "platform",
      "base": [-896, 896],
      "size": [1792, 256],
      "height": 320,
      "floors": 1,
      "roof_access": true,
      "materials": {
        "floor": "twincannon/concretefloor009a_fixed",
        "wall": "twincannon/brushblockmetal",
        "roof": "twincannon/cube_white"
      }
    },
    {
      "id": "ring_bridge_south",
      "style": "platform",
      "base": [-896, -1152],
      "size": [1792, 256],
      "height": 256,
      "floors": 1,
      "roof_access": true,
      "materials": {
        "floor": "twincannon/concretefloor009a_fixed",
        "wall": "twincannon/brushblockmetal",
        "roof": "twincannon/cube_white"
      }
    },
    {
      "id": "punk_north_refinery",
      "style": "tower",
      "base": [1280, 768],
      "size": [640, 512],
      "height": 448,
      "floors": 4,
      "roof_access": true,
      "materials": {
        "floor": "urban/conc_clean2",
        "wall": "vaccinecore/metal_panelwall_001",
        "roof": "vaccine/dys_metalroof"
      }
    },
    {
      "id": "punk_south_refinery",
      "style": "tower",
      "base": [1280, -1280],
      "size": [640, 512],
      "height": 448,
      "floors": 4,
      "roof_access": true,
      "materials": {
        "floor": "urban/conc_clean2",
        "wall": "dys_fortress/dys_fortress-vaccine-detail1base",
        "roof": "vaccine/dys_metalroof"
      }
    },
    {
      "id": "punk_spawn_works",
      "style": "block",
      "base": [1664, -448],
      "size": [512, 896],
      "height": 256,
      "floors": 2,
      "roof_access": true,
      "materials": {
        "floor": "urban/conc_clean2",
        "wall": "urban/dys_urban_chipboard_04",
        "roof": "vaccine/dys_metalroof"
      }
    }
  ],
  "objectives": [
    {
      "type": "datacore",
      "position": [0, 0, 96]
    }
  ],
  "spawns": {
    "corp": [[-1792, 0, -64], [-1792, 256, -64], [-1792, -256, -64]],
    "punk": [[1792, 0, -64], [1792, 256, -64], [1792, -256, -64]]
  },
  "props": [
    {
      "id": "corp_lamp_north",
      "model": "models/props_wasteland/prison_lamp001b.mdl",
      "origin": [-1664, 512, 128],
      "angles": [0, 0, 0],
      "zone": "corp_spire",
      "purpose": "spawn_lighting"
    },
    {
      "id": "corp_lamp_south",
      "model": "models/props_wasteland/prison_lamp001b.mdl",
      "origin": [-1664, -512, 128],
      "angles": [0, 0, 0],
      "zone": "corp_spire",
      "purpose": "spawn_lighting"
    },
    {
      "id": "punk_lamp_north",
      "model": "models/props_wasteland/prison_lamp001b.mdl",
      "origin": [1664, 512, 128],
      "angles": [0, 180, 0],
      "zone": "punk_refinery",
      "purpose": "spawn_lighting"
    },
    {
      "id": "punk_lamp_south",
      "model": "models/props_wasteland/prison_lamp001b.mdl",
      "origin": [1664, -512, 128],
      "angles": [0, 180, 0],
      "zone": "punk_refinery",
      "purpose": "spawn_lighting"
    },
    {
      "id": "core_console_west",
      "model": "models/props/monitor01.mdl",
      "origin": [-384, 512, 96],
      "angles": [0, 90, 0],
      "zone": "mid_exchange",
      "purpose": "objective_landmark"
    },
    {
      "id": "core_console_east",
      "model": "models/props/monitor01.mdl",
      "origin": [384, -512, 96],
      "angles": [0, 270, 0],
      "zone": "mid_exchange",
      "purpose": "objective_landmark"
    },
    {
      "id": "pipe_run_north",
      "model": "models/dys_cybernetic/pipes/pipe_main_64x512.mdl",
      "origin": [1408, 896, 224],
      "angles": [0, 90, 0],
      "zone": "punk_refinery",
      "purpose": "skyline_detail"
    },
    {
      "id": "pipe_run_south",
      "model": "models/dys_cybernetic/pipes/pipe_main_64x512.mdl",
      "origin": [-1408, -896, 224],
      "angles": [0, 90, 0],
      "zone": "corp_spire",
      "purpose": "skyline_detail"
    }
  ],
  "entities": [
    {
      "classname": "env_cubemap",
      "origin": [0, 0, 192]
    },
    {
      "classname": "env_cubemap",
      "origin": [-1664, 0, 192]
    },
    {
      "classname": "env_cubemap",
      "origin": [1664, 0, 192]
    },
    {
      "classname": "env_cubemap",
      "origin": [0, 1024, 192]
    },
    {
      "classname": "env_cubemap",
      "origin": [0, -1024, 192]
    }
  ]
}
